### ISSUE TITLE
Sending HTTP GET during SSL handshake. (proxy SSL)

### ISSUE THREAD

**Issue by jhseodev** [intel/asynch_mode_nginx#27]
Hi,

In reverse proxy configuration, we have identified a problem that send `HTTP GET` to the server during handshake.
This problem occurs after the proxy receives a `ServerHello` in a situation where approximately 1000 CPS load is applied.
**Not all traffic fails (some traffic fails)**

- tcpdump
```
// 10.1.1.174 = client ip addr, 30.1.1.14 = server ip addr

 219827 12.080228   10.1.1.174            52327  30.1.1.14             443    TCP      74     52327→443 [SYN] Seq=0 Win=5840 Len=0 MSS=1460 SACK_PERM=1 TSval=101322087 TSecr=0 WS=256
 219833 12.080289   30.1.1.14             443    10.1.1.174            52327  TCP      74     443→52327 [SYN, ACK] Seq=0 Ack=1 Win=32768 Len=0 MSS=1460 WS=1 TSval=0 TSecr=101322087
 219836 12.080298   10.1.1.174            52327  30.1.1.14             443    TCP      66     52327→443 [ACK] Seq=1 Ack=1 Win=5888 Len=0 TSval=101322087 TSecr=0
 219862 12.080446   10.1.1.174            52327  30.1.1.14             443    TLSv1.2  242    Client Hello
 219906 12.080534   30.1.1.14             443    10.1.1.174            52327  TLSv1.2  878    Server Hello, Certificate, Server Hello Done
 219908 12.080544   10.1.1.174            52327  30.1.1.14             443    TCP      66     52327→443 [ACK] Seq=177 Ack=813 Win=7680 Len=0 TSval=101322087 TSecr=0
 219960 12.081126   10.1.1.174            52327  30.1.1.14             443    TLSv1.2  113    Continuation Data
 219966 12.081181   30.1.1.14             443    10.1.1.174            52327  TLSv1.2  73     Alert (Level: Fatal, Description: Protocol Version)
 219970 12.081245   30.1.1.14             443    10.1.1.174            52327  TCP      60     443→52327 [FIN, ACK] Seq=820 Ack=224 Win=32768 Len=0
 219971 12.081253   30.1.1.14             443    10.1.1.174            52327  TCP      60     443→52327 [RST, ACK] Seq=821 Ack=224 Win=32768 Len=0
 223958 12.150892   10.1.1.174            52327  30.1.1.14             443    TCP      66     52327→443 [RST, ACK] Seq=224 Ack=821 Win=7680 Len=0 TSval=101322094 TSecr=0
```

- Network
```
Client <---> 80 Proxy <---> 443 Server
```
- Version
  - nginx: 1.11.5
  - qat_engine: 0.5.37
  - async_mode_nginx: 0.3.5
- nginx configuration
```
ssl_engine {
    use_engine qat;
    default_algorithms RSA,PKEY,PKEY_CRYPTO;
    qat_engine {
        qat_offload_mode async;
        qat_notify_mode poll;
        qat_poll_mode internal;
        qat_internal_poll_interval 1000000;
    }
}

upstream backend_server {
    server backend_server_ip:443;
    ...
}

server {
    listen proxy_ip:80;
    proxy_bind $remote_addr transparent;
    ...
    location {
        proxy_pass https://backend_server;
        proxy_ssl_asynch on;
        ...
    }
}
```

In the first `SSL_do_handshake`, the `c->write->handler` is maintained if the non-block socket is successfully read,
In the next write event, we verified that an HTTP GET was sent from `ngx_http_upstream_send_request_handler`.

Assigning `ngx_ssl_empty_handler` to the write handler solves this problem.

```diff
diff --git a/nginx/src/event/ngx_event_openssl.c b/nginx/src/event/ngx_event_openssl.c
index 07b7cc2..53bf1b6 100644
--- a/nginx/src/event/ngx_event_openssl.c
+++ b/nginx/src/event/ngx_event_openssl.c
@@ -1608,6 +1608,10 @@ ngx_ssl_handshake(ngx_connection_t *c)
             c->read->saved_handler = c->read->handler;
             c->read->handler = ngx_ssl_empty_handler;
         }
+        if (c->write->handler != ngx_ssl_empty_handler) {
+            c->write->saved_handler = c->write->handler;
+            c->write->handler = ngx_ssl_empty_handler;
+        }
 
         ngx_add_timer(c->async, NGX_ASYNC_EVENT_TIMEOUT);
 
@@ -1665,6 +1669,10 @@ ngx_ssl_handshake_async_handler(ngx_event_t *aev)
         c->read->handler = c->read->saved_handler;
         c->read->saved_handler = ngx_ssl_empty_handler;
     }
+    if (c->write->saved_handler != ngx_ssl_empty_handler) {
+        c->write->handler = c->write->saved_handler;
+        c->write->saved_handler = ngx_ssl_empty_handler;
+    }
 
     if (ngx_ssl_handshake(c) == NGX_AGAIN) {
         return;
```

Give us feedback.

Thank you.

**Comment by zhangp8x** [comment]
Dear jhseodev:
Now the newest release of async-ngnix is 0.3.7, could you please try the newest codes to test this issue?

**Comment by jhseodev** [comment]
@zhangp8x
It may take several days to change the code base.
I will comment when the test is completed.
Thank you.

**Comment by jhseodev** [comment]
@zhangp8x 
There seems to be no commits affecting this problem between version 0.3.5 and version 0.3.7.
Even if change the codebase, the latest 0.3.7 version of the `ngx_ssl_handshake` function is no different from the 0.3.5 version.

I suspect that the version upgrade will not affect troubleshooting because the first `SSL_do_handshake()` call might return `SSL_ERROR_WANT_ASYNC`.
I think it seems to be the point of problem solving how to handle `SSL_ERROR_WANT_ASYNC` when the first sslerr is `SSL_ERROR_WANT_ASYNC`.

If the content of the comment is insufficient, i can add it.
If possible, we would like the analysis in the current situation to proceed first.

Thank you.

**Comment by zhangp8x** [comment]
@jhseodev 
Thank you for your reply, we’ll check this issue and give you a feedback asap

**Comment by yongchengmiao** [comment]
@jhseodev 
Sincere apologies for very late reply to this issue.
We intend to merge this issue as pull request which will go through the internal process and should be available in the next release. But before that the commit message in the pull request does not contain "Signed-off-by:" in it adhering to license and Developer Certification of Origin.
Could you please update the pull request commit message with "Signed-off-by:" in the following format

> Signed-off-by: Name

_eg : Signed-off-by: xxx@gmail.com_
Note: You are required to use your real name in the sign-off message.

**Comment by yongchengmiao** [comment]
Thank you for your great help, we are going to include the patch. Since no sign-off-by message is provided, we have to commit it to internal branch without author info.

**Comment by jhseodev** [comment]
@yongchengmiao 
thank you for reply. please confirm the pull request.

**Comment by yongchengmiao** [comment]
@jhseodev Your patch has been included in the latest release, thanks for your contribution!
